{
  "technology": "gas_ccgt",
  "capacity_mw": 200,
  "capex_usd": 160000000,
  "annual_opex_usd": 4000000,
  "annual_fuel_cost_usd": 25000000,
  "annual_generation_mwh": 1400000,
  "project_lifetime_years": 30,
  "discount_rate": 0.10,
  "degradation_rate": 0.001,
  "opex_escalation_rate": 0.025,
  "fuel_escalation_rate": 0.03
}
